{
  "test_case_id": "TC-028",
  "title": "Change in Tumor Size by Cycle (Longitudinal)",
  "parameters": {
    "seed": 42,
    "n_subjects": 150
  },
  "cycles": ["C1D1", "C2D1", "C3D1", "C4D1", "C5D1", "C6D1"],
  "baseline_cycle": "C1D1",
  "visit_summaries": {
    "C1D1": {
      "all": {
        "cycle": "C1D1",
        "arm": "All",
        "n_total": 150,
        "n_assessed": 150,
        "n_missing": 0,
        "mean_pct_change": 0,
        "median_pct_change": 0,
        "se_pct_change": 0,
        "mean_sld": 74.48,
        "median_sld": 77.55,
        "min_pct_change": 0,
        "max_pct_change": 0
      },
      "experimental": {
        "cycle": "C1D1",
        "arm": "Experimental",
        "n_total": 75,
        "n_assessed": 75,
        "n_missing": 0,
        "mean_pct_change": 0,
        "median_pct_change": 0,
        "se_pct_change": 0,
        "mean_sld": 73.34,
        "median_sld": 75.9,
        "min_pct_change": 0,
        "max_pct_change": 0
      },
      "control": {
        "cycle": "C1D1",
        "arm": "Control",
        "n_total": 75,
        "n_assessed": 75,
        "n_missing": 0,
        "mean_pct_change": 0,
        "median_pct_change": 0,
        "se_pct_change": 0,
        "mean_sld": 75.62,
        "median_sld": 79.7,
        "min_pct_change": 0,
        "max_pct_change": 0
      }
    },
    "C2D1": {
      "all": {
        "cycle": "C2D1",
        "arm": "All",
        "n_total": 150,
        "n_assessed": 141,
        "n_missing": 9,
        "mean_pct_change": -29.16,
        "median_pct_change": -28.1,
        "se_pct_change": 2.713,
        "mean_sld": 51.99,
        "median_sld": 46,
        "min_pct_change": -120.2,
        "max_pct_change": 30.9
      },
      "experimental": {
        "cycle": "C2D1",
        "arm": "Experimental",
        "n_total": 75,
        "n_assessed": 70,
        "n_missing": 5,
        "mean_pct_change": -46.12,
        "median_pct_change": -44,
        "se_pct_change": 3.643,
        "mean_sld": 39.33,
        "median_sld": 33.75,
        "min_pct_change": -120.2,
        "max_pct_change": 9.5
      },
      "control": {
        "cycle": "C2D1",
        "arm": "Control",
        "n_total": 75,
        "n_assessed": 71,
        "n_missing": 4,
        "mean_pct_change": -12.43,
        "median_pct_change": -8.7,
        "se_pct_change": 2.878,
        "mean_sld": 64.48,
        "median_sld": 61.2,
        "min_pct_change": -70.3,
        "max_pct_change": 30.9
      }
    },
    "C3D1": {
      "all": {
        "cycle": "C3D1",
        "arm": "All",
        "n_total": 150,
        "n_assessed": 129,
        "n_missing": 21,
        "mean_pct_change": -31.91,
        "median_pct_change": -25.7,
        "se_pct_change": 4.087,
        "mean_sld": 51.88,
        "median_sld": 49.9,
        "min_pct_change": -189.1,
        "max_pct_change": 50
      },
      "experimental": {
        "cycle": "C3D1",
        "arm": "Experimental",
        "n_total": 75,
        "n_assessed": 61,
        "n_missing": 14,
        "mean_pct_change": -58.43,
        "median_pct_change": -51.6,
        "se_pct_change": 5.93,
        "mean_sld": 35.85,
        "median_sld": 32,
        "min_pct_change": -189.1,
        "max_pct_change": 12.1
      },
      "control": {
        "cycle": "C3D1",
        "arm": "Control",
        "n_total": 75,
        "n_assessed": 68,
        "n_missing": 7,
        "mean_pct_change": -8.12,
        "median_pct_change": -4.3,
        "se_pct_change": 3.8,
        "mean_sld": 66.25,
        "median_sld": 63.7,
        "min_pct_change": -104.5,
        "max_pct_change": 50
      }
    },
    "C4D1": {
      "all": {
        "cycle": "C4D1",
        "arm": "All",
        "n_total": 150,
        "n_assessed": 115,
        "n_missing": 35,
        "mean_pct_change": -29.99,
        "median_pct_change": -21.5,
        "se_pct_change": 5.323,
        "mean_sld": 55.34,
        "median_sld": 53.4,
        "min_pct_change": -248.2,
        "max_pct_change": 66
      },
      "experimental": {
        "cycle": "C4D1",
        "arm": "Experimental",
        "n_total": 75,
        "n_assessed": 54,
        "n_missing": 21,
        "mean_pct_change": -62.01,
        "median_pct_change": -47.85,
        "se_pct_change": 8.336,
        "mean_sld": 37.8,
        "median_sld": 31.95,
        "min_pct_change": -248.2,
        "max_pct_change": 18.1
      },
      "control": {
        "cycle": "C4D1",
        "arm": "Control",
        "n_total": 75,
        "n_assessed": 61,
        "n_missing": 14,
        "mean_pct_change": -1.64,
        "median_pct_change": 2.2,
        "se_pct_change": 4.318,
        "mean_sld": 70.87,
        "median_sld": 76,
        "min_pct_change": -96,
        "max_pct_change": 66
      }
    },
    "C5D1": {
      "all": {
        "cycle": "C5D1",
        "arm": "All",
        "n_total": 150,
        "n_assessed": 88,
        "n_missing": 62,
        "mean_pct_change": -26.94,
        "median_pct_change": -18.35,
        "se_pct_change": 6.298,
        "mean_sld": 57.98,
        "median_sld": 53.35,
        "min_pct_change": -240.8,
        "max_pct_change": 53.1
      },
      "experimental": {
        "cycle": "C5D1",
        "arm": "Experimental",
        "n_total": 75,
        "n_assessed": 47,
        "n_missing": 28,
        "mean_pct_change": -57.16,
        "median_pct_change": -45.9,
        "se_pct_change": 9.134,
        "mean_sld": 39.26,
        "median_sld": 34.7,
        "min_pct_change": -240.8,
        "max_pct_change": 26.5
      },
      "control": {
        "cycle": "C5D1",
        "arm": "Control",
        "n_total": 75,
        "n_assessed": 41,
        "n_missing": 34,
        "mean_pct_change": 7.7,
        "median_pct_change": 9.8,
        "se_pct_change": 4.362,
        "mean_sld": 79.43,
        "median_sld": 77.5,
        "min_pct_change": -68.8,
        "max_pct_change": 53.1
      }
    },
    "C6D1": {
      "all": {
        "cycle": "C6D1",
        "arm": "All",
        "n_total": 150,
        "n_assessed": 71,
        "n_missing": 79,
        "mean_pct_change": -23.73,
        "median_pct_change": -17.9,
        "se_pct_change": 7.482,
        "mean_sld": 61.5,
        "median_sld": 53.5,
        "min_pct_change": -233.4,
        "max_pct_change": 73.3
      },
      "experimental": {
        "cycle": "C6D1",
        "arm": "Experimental",
        "n_total": 75,
        "n_assessed": 41,
        "n_missing": 34,
        "mean_pct_change": -54.59,
        "median_pct_change": -47.3,
        "se_pct_change": 9.789,
        "mean_sld": 41.21,
        "median_sld": 31.1,
        "min_pct_change": -233.4,
        "max_pct_change": 35.8
      },
      "control": {
        "cycle": "C6D1",
        "arm": "Control",
        "n_total": 75,
        "n_assessed": 30,
        "n_missing": 45,
        "mean_pct_change": 18.45,
        "median_pct_change": 18.9,
        "se_pct_change": 5.743,
        "mean_sld": 89.22,
        "median_sld": 86.8,
        "min_pct_change": -64.5,
        "max_pct_change": 73.3
      }
    }
  },
  "overall_summary": {
    "experimental": {
      "arm": "Experimental",
      "n_subjects": 75,
      "mean_best_pct_change": -63.85,
      "median_best_pct_change": -53.8,
      "mean_worst_pct_change": -36.76,
      "median_worst_pct_change": -36.7,
      "mean_n_assessments": 3.6
    },
    "control": {
      "arm": "Control",
      "n_subjects": 75,
      "mean_best_pct_change": -15.46,
      "median_best_pct_change": -11.7,
      "mean_worst_pct_change": 9.5,
      "median_worst_pct_change": 15.7,
      "mean_n_assessments": 3.6
    }
  },
  "subject_summaries": [
    {
      "USUBJID": "SUBJ-0001",
      "TRT01A": "Experimental",
      "best_pct_change": -248.2,
      "worst_pct_change": -120.2,
      "time_to_best_cycle": "C4D1",
      "time_to_worst_cycle": "C2D1",
      "n_assessments": 5
    },
    {
      "USUBJID": "SUBJ-0002",
      "TRT01A": "Experimental",
      "best_pct_change": -128.3,
      "worst_pct_change": -88.2,
      "time_to_best_cycle": "C3D1",
      "time_to_worst_cycle": "C2D1",
      "n_assessments": 2
    },
    {
      "USUBJID": "SUBJ-0003",
      "TRT01A": "Experimental",
      "best_pct_change": -159.6,
      "worst_pct_change": -80.2,
      "time_to_best_cycle": "C4D1",
      "time_to_worst_cycle": "C2D1",
      "n_assessments": 4
    },
    {
      "USUBJID": "SUBJ-0004",
      "TRT01A": "Experimental",
      "best_pct_change": -48.5,
      "worst_pct_change": -45.9,
      "time_to_best_cycle": "C4D1",
      "time_to_worst_cycle": "C2D1",
      "n_assessments": 5
    },
    {
      "USUBJID": "SUBJ-0005",
      "TRT01A": "Experimental",
      "best_pct_change": -47.7,
      "worst_pct_change": -36.2,
      "time_to_best_cycle": "C2D1",
      "time_to_worst_cycle": "C6D1",
      "n_assessments": 5
    },
    {
      "USUBJID": "SUBJ-0006",
      "TRT01A": "Experimental",
      "best_pct_change": -39.9,
      "worst_pct_change": 0.9,
      "time_to_best_cycle": "C2D1",
      "time_to_worst_cycle": "C6D1",
      "n_assessments": 5
    },
    {
      "USUBJID": "SUBJ-0007",
      "TRT01A": "Experimental",
      "best_pct_change": -93.7,
      "worst_pct_change": -58.1,
      "time_to_best_cycle": "C3D1",
      "time_to_worst_cycle": "C2D1",
      "n_assessments": 5
    },
    {
      "USUBJID": "SUBJ-0008",
      "TRT01A": "Experimental",
      "best_pct_change": -54.3,
      "worst_pct_change": -36,
      "time_to_best_cycle": "C3D1",
      "time_to_worst_cycle": "C6D1",
      "n_assessments": 5
    },
    {
      "USUBJID": "SUBJ-0009",
      "TRT01A": "Experimental",
      "best_pct_change": -74.1,
      "worst_pct_change": -46,
      "time_to_best_cycle": "C3D1",
      "time_to_worst_cycle": "C2D1",
      "n_assessments": 2
    },
    {
      "USUBJID": "SUBJ-0010",
      "TRT01A": "Experimental",
      "best_pct_change": -223.1,
      "worst_pct_change": -107.3,
      "time_to_best_cycle": "C4D1",
      "time_to_worst_cycle": "C2D1",